text,author
Genius is one percent inspiration and ninety-nine percent perspiration.,"Thomas Edison, type.fit"
You can observe a lot just by watching.,"Yogi Berra, type.fit"
A house divided against itself cannot stand.,"Abraham Lincoln, type.fit"
Difficulties increase the nearer we get to the goal.,"Johann Wolfgang von Goethe, type.fit"
Fate is in your hands and no one elses,"Byron Pulsifer, type.fit"
Be the chief but never the lord.,"Lao Tzu, type.fit"
Nothing happens unless first we dream.,"Carl Sandburg, type.fit"
Well begun is half done.,"Aristotle, type.fit"
"Life is a learning experience, only if you learn.",Yogi Berra
Self-complacency is fatal to progress.,"Margaret Sangster, type.fit"
Peace comes from within. Do not seek it without.,"Buddha, type.fit"
What you give is what you get.,"Byron Pulsifer, type.fit"
We can only learn to love by loving.,"Iris Murdoch, type.fit"
Life is change. Growth is optional. Choose wisely.,"Karen Clark, type.fit"
You'll see it when you believe it.,"Wayne Dyer, type.fit"
Today is the tomorrow we worried about yesterday.,type.fit
